{
  "repository": {
    "root": "/absolute/path/to/serenity-host",
    "branch": "main",
    "head": "0000000000000000000000000000000000000000",
    "worktree_clean": true
  },
  "serenity_version": "10.5.2",
  "dotnet_version": "10.0.0",
  "node_version": null,
  "package_manager": null,
  "capabilities": []
}
